{
  "angle_units": "degrees",
  "chi_order": "chi1_to_chiN",
  "disulfide_bonds": [],
  "format": "pheat.residue-geometry-structure",
  "metadata": {},
  "name": "sequence:AG",
  "residues": [
    {
      "chain_id": "A",
      "chi": [],
      "name": "ALA",
      "phi": null,
      "psi": -45.0,
      "resseq": 1
    },
    {
      "chain_id": "A",
      "chi": [],
      "name": "GLY",
      "phi": -60.0,
      "psi": null,
      "resseq": 2
    }
  ],
  "version": 1
}
