{
  "angle_units": "radians",
  "chi_order": "chi1_to_chiN",
  "disulfide_bonds": [],
  "format": "pheat.residue-geometry-structure",
  "metadata": {
    "residue_count": 2,
    "source": "atom_structure",
    "source_name": "sequence:AG",
    "warnings": []
  },
  "name": "sequence:AG",
  "residues": [
    {
      "chain_id": "A",
      "chi": [],
      "name": "ALA",
      "phi": null,
      "psi": -0.785398163397,
      "resseq": 1
    },
    {
      "chain_id": "A",
      "chi": [],
      "name": "GLY",
      "phi": -1.047197551197,
      "psi": null,
      "resseq": 2
    }
  ],
  "version": 1
}
