{
  "angle_units": "degrees",
  "chi_order": "chi1_to_chiN",
  "disulfide_bonds": [],
  "format": "pheat.residue-geometry-structure",
  "metadata": {
    "residue_count": 20,
    "source": "atom_structure",
    "source_name": "2mu7.pdb",
    "warnings": []
  },
  "name": "2mu7.pdb",
  "residues": [
    {
      "chain_id": "A",
      "chi": [],
      "name": "GLY",
      "phi": null,
      "psi": 134.391502310231,
      "resseq": 1
    },
    {
      "chain_id": "A",
      "chi": [
        -166.405678713456,
        88.352522929489
      ],
      "name": "TYR",
      "phi": -68.773394741811,
      "psi": -47.875558281961,
      "resseq": 2
    },
    {
      "chain_id": "A",
      "chi": [
        -174.26512298385
      ],
      "name": "SER",
      "phi": -93.003756455455,
      "psi": 69.638071362104,
      "resseq": 3
    },
    {
      "chain_id": "A",
      "chi": [
        167.615189308857,
        65.476180036605
      ],
      "name": "LEU",
      "phi": -167.838936109158,
      "psi": -80.578802721394,
      "resseq": 4
    },
    {
      "chain_id": "A",
      "chi": [
        -62.306810861554,
        -75.366046686123
      ],
      "name": "PHE",
      "phi": -66.792058705143,
      "psi": -48.455866519137,
      "resseq": 5
    },
    {
      "chain_id": "A",
      "chi": [
        -130.721280151863,
        -65.731186248955,
        97.200444126522
      ],
      "name": "GLN",
      "phi": -79.532650909962,
      "psi": -15.026721613403,
      "resseq": 6
    },
    {
      "chain_id": "A",
      "chi": [
        178.345543981015,
        174.76696680515,
        -179.428199651645,
        179.879279278383
      ],
      "name": "LYS",
      "phi": -54.350149213482,
      "psi": -52.78942853895,
      "resseq": 7
    },
    {
      "chain_id": "A",
      "chi": [
        -105.778207358918,
        -85.478090242753,
        -93.391093230954
      ],
      "name": "GLU",
      "phi": -74.274019797605,
      "psi": -32.780019188587,
      "resseq": 8
    },
    {
      "chain_id": "A",
      "chi": [
        -170.44148570526,
        65.342716473595,
        179.048175484473,
        179.410073081811
      ],
      "name": "LYS",
      "phi": -65.669228643604,
      "psi": -39.242493093983,
      "resseq": 9
    },
    {
      "chain_id": "A",
      "chi": [
        -171.75834277129,
        60.130115892392,
        -178.982250433527
      ],
      "name": "MET",
      "phi": -53.542913852204,
      "psi": -32.588055459242,
      "resseq": 10
    },
    {
      "chain_id": "A",
      "chi": [
        -173.484364314451
      ],
      "name": "VAL",
      "phi": -69.478831352464,
      "psi": -53.013351025252,
      "resseq": 11
    },
    {
      "chain_id": "A",
      "chi": [
        -152.572625330795,
        71.761611288004
      ],
      "name": "LEU",
      "phi": -56.739423103762,
      "psi": -48.575089430057,
      "resseq": 12
    },
    {
      "chain_id": "A",
      "chi": [
        -166.325264494025,
        76.590015685486
      ],
      "name": "ASN",
      "phi": -65.563293048897,
      "psi": -46.542461992742,
      "resseq": 13
    },
    {
      "chain_id": "A",
      "chi": [
        79.84356276968,
        -179.396777388656,
        -87.881126700164
      ],
      "name": "GLU",
      "phi": -62.867372452073,
      "psi": -34.898132690172,
      "resseq": 14
    },
    {
      "chain_id": "A",
      "chi": [],
      "name": "GLY",
      "phi": -92.266952395111,
      "psi": -92.880243130232,
      "resseq": 15
    },
    {
      "chain_id": "A",
      "chi": [
        -168.73118120418
      ],
      "name": "THR",
      "phi": -68.605844172824,
      "psi": -45.733076649768,
      "resseq": 16
    },
    {
      "chain_id": "A",
      "chi": [
        -60.103183662642
      ],
      "name": "SER",
      "phi": -94.961714070496,
      "psi": 63.932099187571,
      "resseq": 17
    },
    {
      "chain_id": "A",
      "chi": [],
      "name": "GLY",
      "phi": 177.11970698431,
      "psi": -75.203435746102,
      "resseq": 18
    },
    {
      "chain_id": "A",
      "chi": [
        64.872897868736
      ],
      "name": "THR",
      "phi": 60.000076725715,
      "psi": 92.843522029743,
      "resseq": 19
    },
    {
      "chain_id": "A",
      "chi": [],
      "name": "ALA",
      "phi": -95.739729181784,
      "psi": null,
      "resseq": 20
    }
  ],
  "version": 1
}
